{
  "$schema": "http://json-schema.org/draft-07/schema#",
  "$id": "https://astrid.local/schemas/rendering/v1/request.json",
  "title": "Astrid render request v1",
  "type": "object",
  "additionalProperties": false,
  "required": [
    "schema_version",
    "timeline_path",
    "output_name"
  ],
  "properties": {
    "schema_version": {
      "type": "integer",
      "const": 1
    },
    "timeline_path": {
      "type": "string",
      "minLength": 1,
      "pattern": "^(?![\\s\\S]*\\u0000)[\\s\\S]*[^ \\t\\n\\r\\f\\v\\u00a0\\u1680\\u2000-\\u200a\\u2028\\u2029\\u202f\\u205f\\u3000\\ufeff][\\s\\S]*(?![\\s\\S])"
    },
    "assets_registry_path": {
      "type": [
        "string",
        "null"
      ],
      "minLength": 1,
      "pattern": "^(?![\\s\\S]*\\u0000)[\\s\\S]*[^ \\t\\n\\r\\f\\v\\u00a0\\u1680\\u2000-\\u200a\\u2028\\u2029\\u202f\\u205f\\u3000\\ufeff][\\s\\S]*(?![\\s\\S])"
    },
    "output_name": {
      "type": "string",
      "pattern": "^[A-Za-z0-9][A-Za-z0-9._-]*(?![\\s\\S])",
      "not": {
        "enum": [
          ".",
          ".."
        ]
      }
    },
    "window": {
      "anyOf": [
        {
          "$ref": "#/definitions/frameWindow"
        },
        {
          "type": "null"
        }
      ]
    },
    "audio": {
      "anyOf": [
        {
          "$ref": "#/definitions/audioOwnership"
        },
        {
          "type": "null"
        }
      ]
    },
    "profile": {
      "anyOf": [
        {
          "$ref": "#/definitions/renderProfile"
        },
        {
          "type": "null"
        }
      ]
    },
    "backend_config": {
      "$ref": "#/definitions/backendConfig"
    },
    "metadata": {
      "$ref": "#/definitions/stringMap"
    }
  },
  "allOf": [
    {
      "if": {
        "required": [
          "audio",
          "profile"
        ],
        "properties": {
          "audio": {
            "const": "rendered"
          },
          "profile": {
            "type": "object"
          }
        }
      },
      "then": {
        "properties": {
          "profile": {
            "required": [
              "audio_codec",
              "audio_sample_rate",
              "audio_channel_layout"
            ],
            "properties": {
              "audio_codec": {
                "type": "string",
                "pattern": "^(?![\\s\\S]*\\u0000)[\\s\\S]*[^ \\t\\n\\r\\f\\v\\u00a0\\u1680\\u2000-\\u200a\\u2028\\u2029\\u202f\\u205f\\u3000\\ufeff][\\s\\S]*(?![\\s\\S])"
              }
            }
          }
        }
      }
    },
    {
      "if": {
        "required": [
          "audio",
          "profile"
        ],
        "properties": {
          "audio": {
            "enum": [
              "passthrough",
              "none"
            ]
          },
          "profile": {
            "type": "object"
          }
        }
      },
      "then": {
        "properties": {
          "profile": {
            "properties": {
              "audio_codec": {
                "type": "null"
              },
              "audio_sample_rate": {
                "type": "null"
              },
              "audio_channel_layout": {
                "type": "null"
              }
            }
          }
        }
      }
    }
  ],
  "definitions": {
    "qualifiedId": {
      "type": "string",
      "pattern": "^[a-z0-9][a-z0-9_-]*(?:\\.[a-z0-9][a-z0-9_-]*)+(?![\\s\\S])"
    },
    "audioOwnership": {
      "type": "string",
      "enum": [
        "rendered",
        "passthrough",
        "none"
      ]
    },
    "positiveRational": {
      "type": "array",
      "minItems": 2,
      "maxItems": 2,
      "items": {
        "type": "integer",
        "minimum": 1
      }
    },
    "frameRange": {
      "type": "array",
      "minItems": 2,
      "maxItems": 2,
      "items": [
        {
          "type": "integer",
          "minimum": 0
        },
        {
          "type": "integer",
          "minimum": 1
        }
      ],
      "additionalItems": false
    },
    "frameWindow": {
      "type": "object",
      "additionalProperties": false,
      "required": [
        "start_frame",
        "end_frame",
        "fps_rational"
      ],
      "properties": {
        "start_frame": {
          "type": "integer",
          "minimum": 0
        },
        "end_frame": {
          "type": "integer",
          "minimum": 1
        },
        "fps_rational": {
          "$ref": "#/definitions/positiveRational"
        },
        "source_range": {
          "anyOf": [
            {
              "$ref": "#/definitions/frameRange"
            },
            {
              "type": "null"
            }
          ]
        },
        "speed": {
          "type": [
            "number",
            "null"
          ],
          "exclusiveMinimum": 0
        }
      }
    },
    "renderProfile": {
      "type": "object",
      "additionalProperties": false,
      "required": [
        "width",
        "height",
        "fps_rational",
        "time_base",
        "container",
        "video_codec",
        "video_profile",
        "video_level",
        "pixel_format",
        "duration_tolerance"
      ],
      "properties": {
        "width": {
          "type": "integer",
          "minimum": 1
        },
        "height": {
          "type": "integer",
          "minimum": 1
        },
        "fps_rational": {
          "$ref": "#/definitions/positiveRational"
        },
        "time_base": {
          "$ref": "#/definitions/positiveRational"
        },
        "container": {
          "type": "string",
          "minLength": 1,
          "pattern": "^(?![\\s\\S]*\\u0000)[\\s\\S]*[^ \\t\\n\\r\\f\\v\\u00a0\\u1680\\u2000-\\u200a\\u2028\\u2029\\u202f\\u205f\\u3000\\ufeff][\\s\\S]*(?![\\s\\S])"
        },
        "video_codec": {
          "type": "string",
          "minLength": 1,
          "pattern": "^(?![\\s\\S]*\\u0000)[\\s\\S]*[^ \\t\\n\\r\\f\\v\\u00a0\\u1680\\u2000-\\u200a\\u2028\\u2029\\u202f\\u205f\\u3000\\ufeff][\\s\\S]*(?![\\s\\S])"
        },
        "video_profile": {
          "type": [
            "string",
            "null"
          ],
          "minLength": 1,
          "pattern": "^(?![\\s\\S]*\\u0000)[\\s\\S]*[^ \\t\\n\\r\\f\\v\\u00a0\\u1680\\u2000-\\u200a\\u2028\\u2029\\u202f\\u205f\\u3000\\ufeff][\\s\\S]*(?![\\s\\S])"
        },
        "video_level": {
          "type": [
            "string",
            "null"
          ],
          "minLength": 1,
          "pattern": "^(?![\\s\\S]*\\u0000)[\\s\\S]*[^ \\t\\n\\r\\f\\v\\u00a0\\u1680\\u2000-\\u200a\\u2028\\u2029\\u202f\\u205f\\u3000\\ufeff][\\s\\S]*(?![\\s\\S])"
        },
        "pixel_format": {
          "type": "string",
          "minLength": 1,
          "pattern": "^(?![\\s\\S]*\\u0000)[\\s\\S]*[^ \\t\\n\\r\\f\\v\\u00a0\\u1680\\u2000-\\u200a\\u2028\\u2029\\u202f\\u205f\\u3000\\ufeff][\\s\\S]*(?![\\s\\S])"
        },
        "audio_codec": {
          "type": [
            "string",
            "null"
          ],
          "minLength": 1,
          "pattern": "^(?![\\s\\S]*\\u0000)[\\s\\S]*[^ \\t\\n\\r\\f\\v\\u00a0\\u1680\\u2000-\\u200a\\u2028\\u2029\\u202f\\u205f\\u3000\\ufeff][\\s\\S]*(?![\\s\\S])"
        },
        "audio_sample_rate": {
          "type": [
            "integer",
            "null"
          ],
          "minimum": 1
        },
        "audio_channel_layout": {
          "type": [
            "string",
            "null"
          ],
          "minLength": 1,
          "pattern": "^(?![\\s\\S]*\\u0000)[\\s\\S]*[^ \\t\\n\\r\\f\\v\\u00a0\\u1680\\u2000-\\u200a\\u2028\\u2029\\u202f\\u205f\\u3000\\ufeff][\\s\\S]*(?![\\s\\S])"
        },
        "duration_tolerance": {
          "type": "integer",
          "minimum": 0
        }
      },
      "oneOf": [
        {
          "properties": {
            "audio_codec": {
              "type": "null"
            },
            "audio_sample_rate": {
              "type": "null"
            },
            "audio_channel_layout": {
              "type": "null"
            }
          }
        },
        {
          "required": [
            "audio_codec",
            "audio_sample_rate",
            "audio_channel_layout"
          ],
          "properties": {
            "audio_codec": {
              "type": "string",
              "minLength": 1,
              "pattern": "^(?![\\s\\S]*\\u0000)[\\s\\S]*[^ \\t\\n\\r\\f\\v\\u00a0\\u1680\\u2000-\\u200a\\u2028\\u2029\\u202f\\u205f\\u3000\\ufeff][\\s\\S]*(?![\\s\\S])"
            },
            "audio_sample_rate": {
              "type": "integer",
              "minimum": 1
            },
            "audio_channel_layout": {
              "type": "string",
              "minLength": 1,
              "pattern": "^(?![\\s\\S]*\\u0000)[\\s\\S]*[^ \\t\\n\\r\\f\\v\\u00a0\\u1680\\u2000-\\u200a\\u2028\\u2029\\u202f\\u205f\\u3000\\ufeff][\\s\\S]*(?![\\s\\S])"
            }
          }
        }
      ]
    },
    "backendConfig": {
      "type": "object",
      "propertyNames": {
        "$ref": "#/definitions/qualifiedId"
      },
      "additionalProperties": {
        "type": "object"
      }
    },
    "stringMap": {
      "type": "object",
      "propertyNames": {
        "pattern": "^(?![\\s\\S]*\\u0000)[\\s\\S]*[^ \\t\\n\\r\\f\\v\\u00a0\\u1680\\u2000-\\u200a\\u2028\\u2029\\u202f\\u205f\\u3000\\ufeff][\\s\\S]*(?![\\s\\S])"
      },
      "additionalProperties": {
        "type": "string",
        "pattern": "^(?![\\s\\S]*\\u0000)[\\s\\S]*[^ \\t\\n\\r\\f\\v\\u00a0\\u1680\\u2000-\\u200a\\u2028\\u2029\\u202f\\u205f\\u3000\\ufeff][\\s\\S]*(?![\\s\\S])"
      }
    }
  },
  "examples": [
    {
      "schema_version": 1,
      "timeline_path": "/workspace/timeline.json",
      "assets_registry_path": "/workspace/assets.json",
      "output_name": "preview.mp4",
      "window": {
        "start_frame": 0,
        "end_frame": 48,
        "fps_rational": [
          24,
          1
        ],
        "source_range": [
          10,
          58
        ],
        "speed": 1.0
      },
      "audio": "rendered",
      "profile": {
        "width": 1920,
        "height": 1080,
        "fps_rational": [
          24,
          1
        ],
        "time_base": [
          1,
          12288
        ],
        "container": "mp4",
        "video_codec": "h264",
        "video_profile": "high",
        "video_level": "4.1",
        "pixel_format": "yuv420p",
        "audio_codec": "aac",
        "audio_sample_rate": 48000,
        "audio_channel_layout": "stereo",
        "duration_tolerance": 1
      },
      "backend_config": {
        "acme.example": {
          "quality": "preview"
        }
      },
      "metadata": {
        "project_id": "demo"
      }
    }
  ]
}
