{
  "assets_registry_path": "/private/var/folders/_w/b3tthv192m77c760dbyzvk200000gn/T/tmpwylte2fr/media/assets.json",
  "audio": "rendered",
  "backend_config": {},
  "metadata": {},
  "output_name": "segment-0001.mp4",
  "profile": null,
  "schema_version": 1,
  "timeline_path": "/private/var/folders/_w/b3tthv192m77c760dbyzvk200000gn/T/tmpwylte2fr/.out.mp4.render-service-zxj0yvtf/segment-inputs/0001-timeline.json",
  "window": null
}
