{
  "schema_version": 1,
  "timeline_path": "timeline.json",
  "assets_registry_path": null,
  "output_name": "sdk_noaudio.mp4",
  "window": {
    "start_frame": 0,
    "end_frame": 48,
    "fps_rational": [24, 1],
    "source_range": null,
    "speed": 1.0
  },
  "audio": "none",
  "profile": {
    "width": 1920,
    "height": 1080,
    "fps_rational": [24, 1],
    "time_base": [1, 12288],
    "container": "mp4",
    "video_codec": "h264",
    "video_profile": null,
    "video_level": null,
    "pixel_format": "yuv420p",
    "audio_codec": null,
    "audio_sample_rate": null,
    "audio_channel_layout": null,
    "duration_tolerance": 1
  },
  "backend_config": {
    "sdk.renderer": {
      "mode": "solid"
    }
  },
  "metadata": {
    "fixture": "sdk",
    "purpose": "T6.4 no-audio (visual-only) render"
  }
}
